{
  "schema_version": 1,
  "canonical_sku": "UDW",
  "display_name": "Dream Wall",
  "device_type": "gateway",
  "runtime_aliases": {"api_model": [], "sysid": [], "ssh_model": []},
  "ports": [
    {"index": 1, "label": "Port 1", "connector": "rj45", "max_speed_mbps": 1000, "roles": ["lan"], "poe_in": false, "poe_out": true, "poe_standard": "poe", "poe_max_power_w": 15.4, "combo_group": null},
    {"index": 2, "label": "Port 2", "connector": "rj45", "max_speed_mbps": 1000, "roles": ["lan"], "poe_in": false, "poe_out": true, "poe_standard": "poe", "poe_max_power_w": 15.4, "combo_group": null},
    {"index": 3, "label": "Port 3", "connector": "rj45", "max_speed_mbps": 1000, "roles": ["lan"], "poe_in": false, "poe_out": true, "poe_standard": "poe", "poe_max_power_w": 15.4, "combo_group": null},
    {"index": 4, "label": "Port 4", "connector": "rj45", "max_speed_mbps": 1000, "roles": ["lan"], "poe_in": false, "poe_out": true, "poe_standard": "poe", "poe_max_power_w": 15.4, "combo_group": null},
    {"index": 5, "label": "Port 5", "connector": "rj45", "max_speed_mbps": 1000, "roles": ["lan"], "poe_in": false, "poe_out": true, "poe_standard": "poe+", "poe_max_power_w": 30, "combo_group": null},
    {"index": 6, "label": "Port 6", "connector": "rj45", "max_speed_mbps": 1000, "roles": ["lan"], "poe_in": false, "poe_out": true, "poe_standard": "poe+", "poe_max_power_w": 30, "combo_group": null},
    {"index": 7, "label": "Port 7", "connector": "rj45", "max_speed_mbps": 1000, "roles": ["lan"], "poe_in": false, "poe_out": true, "poe_standard": "poe+", "poe_max_power_w": 30, "combo_group": null},
    {"index": 8, "label": "Port 8", "connector": "rj45", "max_speed_mbps": 1000, "roles": ["lan"], "poe_in": false, "poe_out": true, "poe_standard": "poe+", "poe_max_power_w": 30, "combo_group": null},
    {"index": 9, "label": "Port 9", "connector": "rj45", "max_speed_mbps": 1000, "roles": ["lan"], "poe_in": false, "poe_out": true, "poe_standard": "poe++", "poe_max_power_w": 60, "combo_group": null},
    {"index": 10, "label": "Port 10", "connector": "rj45", "max_speed_mbps": 1000, "roles": ["lan"], "poe_in": false, "poe_out": true, "poe_standard": "poe++", "poe_max_power_w": 60, "combo_group": null},
    {"index": 11, "label": "Port 11", "connector": "rj45", "max_speed_mbps": 1000, "roles": ["lan"], "poe_in": false, "poe_out": true, "poe_standard": "poe++", "poe_max_power_w": 60, "combo_group": null},
    {"index": 12, "label": "Port 12", "connector": "rj45", "max_speed_mbps": 1000, "roles": ["lan"], "poe_in": false, "poe_out": true, "poe_standard": "poe++", "poe_max_power_w": 60, "combo_group": null},
    {"index": 13, "label": "Port 13", "connector": "rj45", "max_speed_mbps": 1000, "roles": ["lan"], "poe_in": false, "poe_out": false, "poe_standard": null, "poe_max_power_w": null, "combo_group": null},
    {"index": 14, "label": "Port 14", "connector": "rj45", "max_speed_mbps": 1000, "roles": ["lan"], "poe_in": false, "poe_out": false, "poe_standard": null, "poe_max_power_w": null, "combo_group": null},
    {"index": 15, "label": "Port 15", "connector": "rj45", "max_speed_mbps": 1000, "roles": ["lan"], "poe_in": false, "poe_out": false, "poe_standard": null, "poe_max_power_w": null, "combo_group": null},
    {"index": 16, "label": "Port 16", "connector": "rj45", "max_speed_mbps": 1000, "roles": ["lan"], "poe_in": false, "poe_out": false, "poe_standard": null, "poe_max_power_w": null, "combo_group": null},
    {"index": 17, "label": "Port 17", "connector": "rj45", "max_speed_mbps": 1000, "roles": ["lan"], "poe_in": false, "poe_out": false, "poe_standard": null, "poe_max_power_w": null, "combo_group": null},
    {"index": 18, "label": "Port 18", "connector": "rj45", "max_speed_mbps": 2500, "roles": ["lan"], "poe_in": false, "poe_out": false, "poe_standard": null, "poe_max_power_w": null, "combo_group": null},
    {"index": 19, "label": "Port 19", "connector": "sfp_plus", "max_speed_mbps": 10000, "roles": ["lan"], "poe_in": false, "poe_out": false, "poe_standard": null, "poe_max_power_w": null, "combo_group": null},
    {"index": 20, "label": "Port 20", "connector": "sfp_plus", "max_speed_mbps": 10000, "roles": ["lan"], "poe_in": false, "poe_out": false, "poe_standard": null, "poe_max_power_w": null, "combo_group": null}
  ],
  "storage": {"nvme": {"supported": false, "present": "not_populated", "capacity_bytes": null}, "sata_ssd": {"supported": true, "present": "present", "capacity_bytes": 128000000000}, "tf": {"supported": true, "present": "not_populated", "capacity_bytes": null}},
  "power": {"psu_slots": 2, "max_power_w": 550}
}
