{
  "schema_version": 1,
  "canonical_sku": "USW-Flex-Mini",
  "display_name": "Flex Mini",
  "device_type": "switch",
  "runtime_aliases": {"api_model": [{"value": "USW Flex Mini", "provenance": "qualified_fixture", "runtime_verified": true, "evidence": "existing normalized UniFi port fixture"}], "sysid": [], "ssh_model": []},
  "ports": [
    {"index": 1, "label": "Port 1", "connector": "rj45", "max_speed_mbps": 1000, "roles": ["lan"], "poe_in": false, "poe_out": false, "poe_standard": null, "poe_max_power_w": null, "combo_group": null},
    {"index": 2, "label": "Port 2", "connector": "rj45", "max_speed_mbps": 1000, "roles": ["lan"], "poe_in": false, "poe_out": false, "poe_standard": null, "poe_max_power_w": null, "combo_group": null},
    {"index": 3, "label": "Port 3", "connector": "rj45", "max_speed_mbps": 1000, "roles": ["lan"], "poe_in": false, "poe_out": false, "poe_standard": null, "poe_max_power_w": null, "combo_group": null},
    {"index": 4, "label": "Port 4", "connector": "rj45", "max_speed_mbps": 1000, "roles": ["lan"], "poe_in": false, "poe_out": false, "poe_standard": null, "poe_max_power_w": null, "combo_group": null},
    {"index": 5, "label": "Port 5", "connector": "rj45", "max_speed_mbps": 1000, "roles": ["lan"], "poe_in": false, "poe_out": false, "poe_standard": null, "poe_max_power_w": null, "combo_group": null}
  ],
  "storage": {"nvme": {"supported": false, "present": "not_populated", "capacity_bytes": null}, "sata_ssd": {"supported": false, "present": "not_populated", "capacity_bytes": null}, "tf": {"supported": false, "present": "not_populated", "capacity_bytes": null}},
  "power": {"psu_slots": 0, "max_power_w": 2.5}
}
